<?xml version="1.0" encoding="UTF-8"?>
<dataroot xmlns:od="urn:schemas-microsoft-com:officedata" xmlns:xsi="http://www.w3.org/2001/XMLSchema-instance"  xsi:noNamespaceSchemaLocation="Gloves.xsd" generated="2017-09-04T13:16:56">
<Gloves>
<ID>1</ID>
<GivenID>0</GivenID>
<Level>1</Level>
<Armor>1</Armor>
<EvasionRating>9</EvasionRating>
<EnergyShield>1</EnergyShield>
<RequiredStr>0</RequiredStr>
<RequiredDex>0</RequiredDex>
<RequiredInt>0</RequiredInt>
<ItemName>글로브1</ItemName>
</Gloves>
<Gloves>
<ID>2</ID>
<GivenID>1</GivenID>
<Level>1</Level>
<Armor>2</Armor>
<EvasionRating>8</EvasionRating>
<EnergyShield>47</EnergyShield>
<RequiredStr>0</RequiredStr>
<RequiredDex>0</RequiredDex>
<RequiredInt>0</RequiredInt>
<ItemName>글로브2</ItemName>
</Gloves>
<Gloves>
<ID>3</ID>
<GivenID>2</GivenID>
<Level>1</Level>
<Armor>3</Armor>
<EvasionRating>7</EvasionRating>
<EnergyShield>4</EnergyShield>
<RequiredStr>0</RequiredStr>
<RequiredDex>0</RequiredDex>
<RequiredInt>0</RequiredInt>
<ItemName>글로브3</ItemName>
</Gloves>
<Gloves>
<ID>4</ID>
<GivenID>3</GivenID>
<Level>1</Level>
<Armor>4</Armor>
<EvasionRating>6</EvasionRating>
<EnergyShield>6</EnergyShield>
<RequiredStr>0</RequiredStr>
<RequiredDex>0</RequiredDex>
<RequiredInt>0</RequiredInt>
<ItemName>글로브4</ItemName>
</Gloves>
<Gloves>
<ID>5</ID>
<GivenID>4</GivenID>
<Level>1</Level>
<Armor>5</Armor>
<EvasionRating>5</EvasionRating>
<EnergyShield>2</EnergyShield>
<RequiredStr>0</RequiredStr>
<RequiredDex>0</RequiredDex>
<RequiredInt>0</RequiredInt>
<ItemName>글로브5</ItemName>
</Gloves>
<Gloves>
<ID>6</ID>
<GivenID>5</GivenID>
<Level>1</Level>
<Armor>6</Armor>
<EvasionRating>4</EvasionRating>
<EnergyShield>5</EnergyShield>
<RequiredStr>0</RequiredStr>
<RequiredDex>0</RequiredDex>
<RequiredInt>0</RequiredInt>
<ItemName>글로브6</ItemName>
</Gloves>
<Gloves>
<ID>7</ID>
<GivenID>6</GivenID>
<Level>1</Level>
<Armor>7</Armor>
<EvasionRating>4</EvasionRating>
<EnergyShield>9</EnergyShield>
<RequiredStr>0</RequiredStr>
<RequiredDex>0</RequiredDex>
<RequiredInt>0</RequiredInt>
<ItemName>글로브7</ItemName>
</Gloves>
<Gloves>
<ID>8</ID>
<GivenID>7</GivenID>
<Level>1</Level>
<Armor>8</Armor>
<EvasionRating>3</EvasionRating>
<EnergyShield>7</EnergyShield>
<RequiredStr>0</RequiredStr>
<RequiredDex>0</RequiredDex>
<RequiredInt>0</RequiredInt>
<ItemName>글로브8</ItemName>
</Gloves>
<Gloves>
<ID>9</ID>
<GivenID>8</GivenID>
<Level>1</Level>
<Armor>9</Armor>
<EvasionRating>2</EvasionRating>
<EnergyShield>53</EnergyShield>
<RequiredStr>0</RequiredStr>
<RequiredDex>0</RequiredDex>
<RequiredInt>0</RequiredInt>
<ItemName>글로브9</ItemName>
</Gloves>
<Gloves>
<ID>10</ID>
<GivenID>9</GivenID>
<Level>1</Level>
<Armor>10</Armor>
<EvasionRating>1</EvasionRating>
<EnergyShield>2</EnergyShield>
<RequiredStr>0</RequiredStr>
<RequiredDex>0</RequiredDex>
<RequiredInt>0</RequiredInt>
<ItemName>글로브10</ItemName>
</Gloves>
</dataroot>
